{"deck_id":"deck_001","schema_version":"1.0","slides":[{"approved_design":{"path":"designs/S01.png","sha256":"03d7156aa4cf2f626e4b31b892e98623d39deafedd19820b811e616227daff69"},"slide_id":"S01","visual_objects":[{"description":"Right-side abstract visual","handling":{"independent_crop":true,"independent_positioning":true,"z_order_sensitive":true},"id":"hero","overlaps_with":[],"role":"hero_illustration"}],"visual_spec":{"path":"visual-specs/S01.json","sha256":"e405211634925186a9e569d06a55c1dbed38a710202992013fc311923d52175e"}}],"stage1_authority_sha256":"a4e6e6495b18d23183f98ea6751ecfbf7245c2d93a13dec3b933e0ec58395019","status":"approved"}
